,Id,TextContent
325,6667b1bc653280ea254facd7,"Gần đây, Hà Giang chìm trong mưa lớn, gây ra tình trạng ngập úng ở nhiều khu vực đem đến những thách thức không hề nhỏ cho du lịch vùng cao."
326,6667b22b653280ea254facd9,Sự trỗi dậy của các đảng trung hữu và cực hữu trong cuộc bầu cử nghị viện châu Âu gióng lên hồi chuông báo động với nhiều chính phủ hiện tại ở lục địa già.
327,6667b2cf653280ea254facdd,GD&TĐ - Trường đại học Lạc Hồng là trường đầu tiên của Việt Nam tham gia đánh giá chất lượng cấp cơ sở giáo dục theo chuẩn AUN-QA 3.0.
328,6667b2e2653280ea254facdf,"Tổng thống Hungary Sulyok sẽ không dự hội nghị thượng đỉnh của 9 nước châu Âu ở sườn đông NATO, khi Budapest và liên minh ngày càng bất đồng."
329,6667b2e3653280ea254face1,"Park, nữ sinh 18 tuổi, không ăn gì ngoài uống nước, bổ sung muối và một số chất dinh dưỡng."
330,6667b304653280ea254face3,VTV.vn - Từng đối mặt với Yên để bảo vệ em trai nhưng lần này Hùng gặp lại Yên trong hoàn cảnh cô bị tai nạn và nhất quyết đòi anh đưa về nhà.
331,6667b359653280ea254face5,Chủ tịch DMCC Ahmed Bin Sulayem đã chọn Jemmia Diamond là doanh nghiệp kim cương Việt ông đến thăm trong sự kiện xúc tiến thương mại ngày 05/06 vừa qua.
332,6667b35a653280ea254face7,"(Tổ Quốc) - Tối 10/6 theo giờ địa phương, đội tuyển Việt Nam đã có buổi tập làm quen với sân thi đấu Basra International và hoàn thiện khâu chuẩn bị cuối cùng cho cuộc đối đầu với đội chủ nhà Iraq."
335,6667b464653280ea254faced,"Suri Cruise đã bắt đầu thích nghi với cuộc sống một mình, rời xa vòng tay của mẹ."
336,6667b47d653280ea254facef,Netizen nói gì khi Jennie nắm giữ vị trí vedette kết màn cho show diễn kỉ niệm 15 năm thành lập thương hiệu Jacquemus.
337,6667b498653280ea254facf1,Cựu tổng thống Mỹ Donald Trump xác nhận ông sẽ chịu thẩm vấn từ một nhân viên quản chế trước khi tòa tiến hành tuyên án vào tháng 7. Báo cáo từ cuộc thẩm vấn là một yếu tố để tòa tuyên án.
338,6667b498653280ea254facf5,"Theo Cơ quan Môi trường Singapore, mỗi năm tại nước này có 175 ngày có sấm sét. Tỉ lệ có sét đánh tại nước này gần như 2 ngày 1 lần."
339,6667b498653280ea254facf3,Mỹ cân nhắc đàm phán thỏa thuận đơn phương với Hamas để thả 5 con tin người Mỹ ở Gaza; Ukraine tố Nga phóng bom dẫn đường vào Kharkov; Tổng thống Hungary không dự thượng đỉnh sườn đông NATO... là những tin tức đáng chú ý ngày 11-6.
340,6667b4ba653280ea254facf7,"Phim "" Mặc vũ vân gian "" của Ngô Cẩn Ngôn vừa hé lộ tình tiết mới gây bất ngờ cho khán giả."
341,6667b534653280ea254facf9,GD&TĐ - UBND tỉnh Thái Nguyên vừa có đề xuất về việc hỗ trợ 100% học phí cho trẻ mầm non công lập trên địa bàn.
342,6667b534653280ea254facfb,Sự ủng hộ của hai đảng nhỏ trong Liên minh dân chủ quốc gia (NDA) đã giúp Thủ tướng Ấn Độ Narendra Modi và đảng Nhân dân Ấn Độ (BJP) có được nhiệm kỳ cầm quyền thứ ba liên tiếp.
343,6667b53f653280ea254facfd,"Ông Medvedev nói Tổng thống Pháp Macron, Thủ tướng Đức Scholz nên rời chính trường khi đảng của họ thất thế trong bầu cử Nghị viện châu Âu."
344,6667b542653280ea254facff,Tiền đạo Cristiano Ronaldo thường diện cả set đồ xa xỉ đồng điệu họa tiết hoặc màu sắc.
345,6667b550653280ea254fad01,"Chủ tịch Quốc hội Trần Thanh Mẫn đề nghị Ủy ban Thường vụ Quốc hội xem xét kỹ và thể hiện quan điểm rõ ràng dự án, dự thảo nào đã bảo đảm đủ điều kiện trình Quốc hội thông qua trong Đợt 2 Kỳ họp thứ 7, nhất là những dự án có tác động lớn như Luật Bảo hiểm xã hội (sửa đổi)..."
346,6667b554653280ea254fad03,"VTV.vn - Khi MV ""Sweet Home"" còn chưa lên sóng, Hương Tràm lại khiến người hâm mộ bất ngờ khi tung teaser MV mới ""Chỉ mình anh đi xa"" vào tối 10/6."
347,6667b561653280ea254fad05,"Theo cựu danh thủ Paul Merson, Cristiano Ronaldo nên biết chấp nhận ngồi dự bị trong các trận đấu của đội tuyển Bồ Đào Nha tại EURO 2024, bởi tuổi tác và trình độ không còn ở đẳng cấp cao như trước đây."
348,6667b6f7653280ea254fad07,Câu chuyện được phụ huynh chia sẻ nhận về nhiều sự đồng cảm.
349,6667b713653280ea254fad09,"Nghệ sĩ ballet Nguyễn Đức Hiếu được coi là gương mặt vàng của ballet Việt Nam. Sau gần 20 năm sự nghiệp ballet, anh có hơn 60 Huy chương Vàng, Bạc, Đồng cấp quốc tế và quốc gia, cùng nhiều giải thưởng trong bộ môn ballet và khiêu vũ thể thao. PV Lao Động có cuộc trò chuyện với nghệ sĩ sinh năm 2000 để lắng nghe câu chuyện đầy cảm hứng của anh."
350,6667b722653280ea254fad0b,Hồ Ngọc Hà trông vô cùng gợi cảm khi diện bộ đồ xuyên thấu bên bờ biển tại quê nhà.
351,6667b738653280ea254fad0d,"Hàng triệu học sinh cả nước đã và đang thi tuyển sinh lớp 10 năm học 2024 -2025. Dưới đây là lịch công bố điểm thi, điểm chuẩn lớp 10 của 63 tỉnh, thành trên cả nước."
352,6667b77c653280ea254fad0f,"(PLO)- Nhiều người dân chiếm dụng lối đi bộ và cả lòng cầu để tụ tập buôn bán trên cầu, tiềm ẩn nguy cơ t.a.i n.ạ.n giao thông cho người lưu thông là rất cao."
353,6667b798653280ea254fad11,"(Dân trí) - Năm này qua năm khác, các cuộc bầu cử ở châu Âu, đặc biệt là bầu cử Nghị viện châu Âu, thường nằm ngoài các hoạt động chính trị lớn."
354,6667b79f653280ea254fad13,"VOV.VN - Vietnam Airlines thông báo điều chỉnh kế hoạch khai thác các chuyến bay đến, đi từ sân bay Cam Ranh, Khánh Hòa từ 10/6 đến hết ngày 12/6."
355,6667b79f653280ea254fad15,"VOV.VN - Mưa rất to trên diện rộng gây lũ lớn ở Hà Giang, tuy chưa chạm mốc lịch sử nhưng là hiếm gặp trong 30 năm trở lại đây."
356,6667b79f653280ea254fad17,"VOV.VN - Bộ GTVT vừa đề nghị các địa phương yêu cầu tất cả cơ sở giáo dục từ bậc mầm non đến trung học phổ thông trên địa bàn rà soát lại việc sử dụng xe ô tô đưa đón học sinh đến trường, yêu cầu phải thực hiện đầy đủ quy định về an toàn giao thông đối với phương tiện, người lái xe."
357,6667b79f653280ea254fad19,ANTD.VN - Cơn mưa lớn kéo dài từ đêm 9-6 đến sáng 10-6 đã gây thiệt hại nặng nề về người và tài sản của Nhà nước và người dân tỉnh Hà Giang.
358,6667b79f653280ea254fad1b,"ANTD.VN - Dự thảo Luật Trật tự, an toàn giao thông đường bộ, Bộ Công an đã đề xuất các vị trí người điều khiển phương tiện không được dừng xe, đỗ xe."
359,6667b7a4653280ea254fad1d,VTV.vn - : Evangeline Lilly vừa gây sốc khi thông báo tạm rời xa diễn xuất. Dù không chắc chắn thời gian trở lại nhưng cô nói  có thể quay lại Hollywood một ngày nào đó.
360,6667b7b2653280ea254fad1f,"VTV.vn - Sau nhiều ngày cử người theo dõi, Mỹ Đình đã nói cho Ngân Hà biết một bí mật động trời của An Nhiên."
362,6667b7b7653280ea254fad23,"ANTD.VN -  Theo Nghị định 63/2024/NĐ-CP, từ 1-7 tới sẽ thực hiện liên thông điện tử thủ tục đăng ký khai tử, xóa đăng ký thường trú, giải quyết mai táng phí, tử tuất."
363,6667b7b7653280ea254fad25,"Dự án “Ứng phó khẩn cấp và hỗ trợ phục hồi sinh kế sau Covid-19 cho phụ nữ có nguy cơ bị bạo lực” trị giá 1,46 triệu USD (hơn 36,5 tỷ đồng) do Chính phủ Australia tài trợ được thực hiện từ năm 2022-2024, nhằm hỗ trợ khả năng phục hồi kinh tế của phụ nữ bị ảnh hưởng nặng nề bởi Covid-19 và nâng cao năng lực của các tổ chức địa phương trong việc ứng phó, phòng ngừa bạo lực đối với phụ nữ, đặc biệt trong các tình huống khẩn cấp, đã ghi nhận những kết quả rất khả quan."
364,6667b7bf653280ea254fad5b,"Cơ quan chức năng huyện Quảng Ninh, tỉnh Quảng Bình đang triển khai biện pháp cấp bách bảo vệ động vật nghi là hổ xuất hiện và trấn an người dân không hoang mang, lo lắng."
365,6667b7bf653280ea254fad5e,"Tối 10/6 đã xảy ra việc một người nghi nhảy cầu Vĩnh Tuy, để lại xe máy trên cầu. Hiện lực lượng chức năng đang tích cực tìm kiếm."
366,6667b7bf653280ea254fad61,"Sau cơn mưa lớn kéo dài khoảng 2 tiếng, nhiều tuyến đường ở tỉnh Thái Nguyên bị ngập sâu, đây là địa phương thứ 5 xảy ra ngập úng trong những ngày qua"
367,6667b802653280ea254faeaa,"Gia đình tôi thích ăn thịt bò nhưng thực phẩm này dễ bị làm giả, vậy có cách nào phân biệt? (Chi, 35 tuổi, Hà Nội)"
368,6667b80c653280ea254faeac,"SKĐS - Năm 2024, Trường Đại học Y Hà Nội mở thêm 3 ngành mới gồm: Tâm lý học, Kỹ thuật phục hình răng và Hộ sinh."
372,6667b905653280ea254faeb6,Đã hiểu ngoài kia thế giới yêu nhau kiểu gì.
373,6667b914653280ea254faeb8,Diễn viên Miu Lê đã có màn đáp trả nhận được nhiều lời khen ngợi sau khi bị chê ngoại hình.
374,6667b936653280ea254faeba,"Ở Singapore có một nhà hàng rất đặc biệt, nơi phần lớn nhân viên là người khuyết tật và người yếu thế trong xã hội, đó là Dignity Kitchen."
375,6667b972653280ea254faebc,Trung tâm Bão Quốc gia Mỹ đang theo dõi 4 áp thấp đầu tiên của mùa bão 2024 tính đến ngày 10.6.
376,6667b987653280ea254faebe,"Công ty Công nghệ Maxar mới đưa ra ảnh vệ tinh chất lượng cao hơn về sân bay Akhtubinsk, trong đó cho thấy máy bay chiến đấu thế hệ mới nhất của Nga Su-57 sau vụ tấn công của UAV Ukraine."
377,6667b9de653280ea254faec0,"Trong chương trình Kính đa chiều, Bùi Văn Hải có dịp chia sẻ những kỷ niệm khó quên trong hành trình gắn bó với nghề diễn viên đóng thế (cascadeur)."
378,6667b9de653280ea254faec4,Ca sĩ Hương Tràm tung teaser MV 'Sweet Home' và 'Chỉ mình anh đi xa' đánh dấu sự trở lại làng giải trí Việt sau 5 năm sang Mỹ du học.
379,6667b9e7653280ea254faec6,"Nam chính M trong Gia Tài Của Ngoại là Billkin - nam thần của dòng phim boylove. Ngoài đời, Billkin còn là người thừa kế của một gia tộc giàu có."
380,6667b9ec653280ea254faec8,Giới chức Mỹ cho biết 4 giảng viên nước này tham gia đợt trao đổi giữa các trường đại học đã bị thương sau vụ đâm dao ở Cát Lâm.
381,6667ba0c653280ea254faeca,"(PLO)-  ""Vàng ở trong dự trữ của ngân hàng trung ương được gọi là vàng dự trữ tập trung còn vàng trong dân là vàng phân tán trong dự trữ quốc gia. Vì vậy không nên thành kiến với việc đó""- TS Lê Xuân Nghĩa."
382,6667ba10653280ea254faecc,Bình Thuận - Nam lễ tân khách sạn được phát hiện nằm tử vong trên ghế xếp ở tầng trệt của khách sạn ở Phan Thiết.
383,6667ba12653280ea254faece,(Dân trí) - Quân đội Hàn Quốc cáo buộc binh sĩ Triều Tiên đã bước qua biên giới 2 nước trong một khoảng thời gian ngắn khiến Seoul phải nổ súng cảnh cáo.
384,6667ba12653280ea254faed0,(Dân trí) - Mỹ thông báo sẽ cho phép lữ đoàn Azov của Ukraine sử dụng vũ khí do Washington viện trợ sau nhiều năm ban hành lệnh cấm vì nguồn gốc gây tranh cãi của đơn vị này.
385,6667ba14653280ea254faed2,"VTV.vn - Kết quả phân tích bài thi Đánh giá năng lực đợt 2 cho thấy phân bố điểm của 39.031 bài thi có dạng gần phân bố chuẩn, với điểm trung bình là 725,8."
386,6667ba14653280ea254faed4,Phong trào Hezbollah thông báo đã bắn rơi một máy bay không người lái (UAV) tấn công của Israel tại miền nam Li Băng giữa lúc chiến sự giữa hai bên trở nên căng thẳng.
387,6667ba14653280ea254faed6,"NATO đang sử dụng trí tuệ nhân tạo (AI) để theo dõi các máy bay và trạm tiếp nhiên liệu của Nga, theo Trợ lý tổng thư ký NATO David van Weel."
388,6667ba20653280ea254faed8,"VOV.VN - VOV.VN - Theo luật sư, hành vi lái xe tông vào đuôi xe khác là các hành vi trái pháp luật, tùy thuộc vào tính chất và mức độ vi phạm sẽ bị xử phạt vi phạm hành chính theo quy định tại Điều 7 Nghị định số 144/2021/NĐ-CP của Chính phủ, hoặc truy cứu trách nhiệm hình sự về “tội gây rối trật tự công cộng” hoặc/và “tội cố ý gây thương tích”."
389,6667ba20653280ea254faeda,"Qua điều tra, cơ quan công an xác định nguyên nhân dẫn đến tai nạn khiến đôi nam nữ tử vong là do lái xe tải thiếu chú ý quan sát, lấn làn đường."
390,6667ba20653280ea254faedc,Gia đình mong mọi người để cho 'sư Thích Minh Tuệ' được tiếp tục tu hành theo hạnh đầu đà của Đức Phật.
392,6667ba5d653280ea254faee0,"(Dân trí) - Theo Ủy ban Quốc phòng - An ninh, hầu hết đại biểu Quốc hội nhất trí phương án quy định cấm tuyệt đối nồng độ cồn khi lái xe, không có đoàn đại biểu nào đề nghị lấy ý kiến 2 phương án về nội dung này."
393,6667bb23653280ea254faee2,"90 ngày qua, các y, bác sĩ Khoa Sơ sinh, Bệnh viện Phụ Sản Hà Nội đã trở thành những người mẹ thứ hai của bé sinh non chỉ nặng 650g. 24/24 giờ mỗi ngày, những người mẹ ấy vẫn cần mẫn, tỉ mỉ chăm sóc cho con từng chút một cho tới khi em bé cán mốc cân nặng 3kg."
394,6667bb69653280ea254faee4,"Theo những thông tin mới nhất từ trang chủ của ĐT Hà Lan, đội tuyển này sẽ không có sự phục vụ của tiền vệ Frenkie de Jong tại VCK EURO 2024."
395,6667bb69653280ea254faee6,"Ở tuổi 19, Cristiano Ronaldo được tuyển Hy Lạp dạy cho một bài học sau trận chung kết EURO 2004, đó là với bóng đá không gì chắc chắn cả."
396,6667bb8d653280ea254faee8,"Trước khi ông nội mất, ba tôi ngồi với ông, ông dặn dò toàn bộ tài sản ông để lại cho ba tôi, vậy lời dặn dò này có được xem là di chúc không?"
397,6667bb95653280ea254faeea,"Công chúng được dịp tìm hiểu về nghề khắc in mộc bản Thanh Liễu có tuổi đời gần 600 năm, từng khắc mộc bản triều Nguyễn, mộc bản chùa Vĩnh Nghiêm và mộc bản trường học Phúc Giang đã được UNESCO vinh danh."
398,6667bb95653280ea254faeec,"Gần đây, nhiều người trong giới tỏ vẻ bức xúc vì một clip trích ra từ tập 8 chương trình Học viện cải lương có ca từ bị cho là thô thiển khi đưa thẳng vào những chữ như 'bao cao su', 'tuầy huầy', 'uống thuốc ngừa thai'..."
399,6667bbbb653280ea254faeee,"Phiên họp xem xét, cho ý kiến đối với 8 dự án luật, 3 dự thảo nghị quyết sẽ trình Quốc hội xem xét, thông qua tại đợt 2 của Kỳ họp và 5 nội dung khác thuộc thẩm quyền của Ủy ban Thường vụ Quốc hội."
400,6667bbbd653280ea254faef0,Dưới đây là điểm sàn phương thức xét tuyển sớm trường Đại học Y tế công cộng năm 2024 để thí sinh tham khảo.
401,6667bbc2653280ea254faef2,"Trong phim ""Mặc vũ vân gian"", Ngô Cẩn Ngôn đã có những chia sẻ thú vị về cảnh dầm mình dưới mưa cùng nam chính Vương Tinh Việt."
402,6667bbcb653280ea254faef4,Thượng nghị sĩ Mỹ nói Ukraina là “mỏ vàng” hàng chục nghìn tỉ USD mà Mỹ không muốn để Nga chiếm mất.
403,6667bc0b653280ea254faef6,"Tại km 145 + 430 quốc lộ 6, địa phận: xóm Tam Hòa, xã Đồng Tân, huyện Mai Châu, Hòa Bình đã xảy ra vụ tai nạn giao thông khiến 1 nam tài xế tử vong."
404,6667bc45653280ea254faef8,"ANTD.VN - Ngân hàng UOB cho rằng Ngân hàng Nhà nước sẽ giữ nguyên lãi suất tái cấp vốn ở mức 4,5% như hiện tại cho đến cuối năm, vì việc tăng lãi suất thời điểm này có thể cản trở môi trường tín dụng và thanh khoản."
405,6667bc5d653280ea254faefa,"VTV.vn - Học cũ, dạy cũ nhưng cách ra đề thi mới khiến học sinh dễ mất bình tĩnh, thậm chí là bị bất ngờ."
406,6667bc60653280ea254faefc,VTV.vn - Các thành viên BTS dù đang phục vụ trong quân đội vẫn mong được đoàn tụ để chào mừng ngày xuất ngũ của anh cả Jin.
407,6667bcbc653280ea254fb07d,"SKĐS - Vườn Quốc gia Phong Nha - Kẻ Bàng là khu vực có tính đa dạng sinh học cao, là nơi sinh sống của nhiều loại động vật quý hiếm."
