,Id,TextContent
223,6667a472653280ea254faa58,"Phần tiếp theo của ""Thần thoại"" dự kiến ​​ra mắt vào tháng 7. Ê-kíp sử dụng trí tuệ nhân tạo AI phục hồi gương mặt của Thành Long năm 27 tuổi."
224,6667a490653280ea254faa7b,"Khi đi máy bay, nhiều hành khách thường không biết rằng có rất nhiều đồ dùng miễn phí mà họ có thể yêu cầu từ tiếp viên hàng không."
225,6667a4c1653280ea254faa7d,"ANTD.VN - Ngân hàng Nhà nước đề nghị Bộ Công an xác minh, xử lý các đối tượng tung tin thất thiệt về việc NHNN thiếu vàng để bán; thuê người xếp hàng mua gom vàng với mục tiêu đẩy giá, đầu cơ, trục lợi."
226,6667a4d1653280ea254faa7f,Khán giả tá hỏa khi nhìn thấy diện mạo mới của Jin Goo phim Hậu Duệ Mặt Trời.
227,6667a550653280ea254faa81,"(Dân trí) - Mua nhà dự án của Trung Nguyên tại Đắk Lắk, một số cư dân đã có đơn gửi cơ quan chức năng vì cho rằng chủ đầu tư không thực hiện như cam kết ban đầu và dự án quá hạn nhưng chưa đồng bộ các hạng mục."
228,6667a56d653280ea254faa83,"Có ít nhất 38 người, trong đó hầu hết là phụ nữ, thiệt mạng trong vụ thuyền chở người di cư bị lật ngoài khơi tỉnh Shabwa phía Nam Yemen ngày 10/6. Hiện còn 150 người khác vẫn đang mất tích."
229,6667a649653280ea254faa85,"Cả nước vối và trà xanh đều có tác dụng thanh nhiệt, thải độc, làm chậm quá trình oxy hóa. Tuy nhiên, uống nhiều trà có thể dẫn tới tình trạng say, mất ngủ."
230,6667a6b1653280ea254faa87,Lịch thi đấu bóng chuyền quốc tế ngày 11.6 với sự trở lại của giải Nations League nữ.
231,6667a6b1653280ea254faa89,Đội tuyển Việt Nam đã sẵn sàng đấu chủ nhà Iraq sau buổi tập duy nhất làm quen sân Basra International.
232,6667a6b4653280ea254faa8b,"Màu sắc tươi sáng và tương phản nổi bật hơn, giúp nhân viên cứu hộ và phụ huynh phát hiện trẻ nhanh chóng và dễ dàng, đặc biệt trong những tình huống khẩn cấp."
233,6667a6b4653280ea254faa8d,Hình ảnh được chia sẻ với truyền thông cho thấy thi thể được chất đống đang được vận chuyển bằng xe tới nơi chôn cất.
234,6667a6bf653280ea254faa8f,"Gặp lại Iraq ở trận lượt về khiến chúng ta nghĩ đến trải nghiệm không mấy vui vẻ ở trận lượt đi trên sân Mỹ Đình với bàn thua ngay những giây cuối trận. Đó cũng là khởi đầu cho chuỗi 8 trận liên tiếp bị thủng lưới trong các trận đấu chính thức, một “căn bệnh” thực sự suốt hơn một năm qua."
235,6667a6d2653280ea254faa91,Tình hình của Trần Thị Thanh Thúy đang là vấn đề mà các CĐV Việt Nam quan tâm ở thời điểm này.
236,6667a6e2653280ea254faa93,"Bước vào tuổi dậy thì, con gái của Kaka cùng vợ cũ được nhận xét là ngày càng xinh đẹp, thừa hưởng các nét đẹp từ bố mẹ."
237,6667a6e2653280ea254faa95,"Để phục vụ người hâm mộ tại VCK Euro 2024, nước Đức đã chuẩn bị những Fan Zone rất hoành tráng, với điểm nhấn là các Fan Zone ở Munich và Berlin."
238,6667a70b653280ea254faa97,"Trong loạt ảnh mới ra mắt, nữ diễn viên Kim Ji Won gây sốt với vẻ đẹp lộng lẫy và quyến rũ."
239,6667a714653280ea254faa99,"Con dâu đề nghị được hưởng 2 tỉ trong khối tài sản thừa kế, nhưng phía mẹ chồng chỉ đồng ý trả 1,8 tỉ. Chủ tọa liên tục khuyên nhủ, 'chỉ chênh nhau 200 triệu, có đáng đưa nhau đi kiện ngày này tháng khác không?'."
240,6667a714653280ea254faa9b,"Ủy ban Thường vụ Quốc hội sẽ cho ý kiến với dự án luật sửa đổi hiệu lực của các luật Đất đai, Nhà ở, Kinh doanh bất động sản, Các tổ chức tín dụng. Theo đó, Chính phủ đề xuất 4 luật nói trên có hiệu lực sớm từ 1.8 thay vì từ 1.1.2025."
241,6667a715653280ea254faa9d,"Việc quản lý, sử dụng tài sản công trên địa bàn TP.HCM thực hiện theo Quyết định 27 năm 2018 của UBND TP.HCM về phân cấp quản lý nhà nước đối với tài sản công tại cơ quan hành chính, đơn vị sự nghiệp công lập và các tổ chức được thành lập theo quy định pháp luật."
242,6667a716653280ea254faa9f,"Những khu đất trống bỏ mặc cho cỏ mọc, những mặt bằng đắc địa phủ bụi vì thiếu cơ chế cho thuê đang khiến tài sản công lãng phí kéo dài. Chính quyền TP.HCM đã nhìn nhận rõ thực trạng này và đang thúc đẩy nhiều biện pháp để giải quyết."
243,6667a71b653280ea254faaa1,Hội đồng Bảo an Liên Hiệp Quốc ngày 10.6 thông qua nghị quyết kêu gọi Israel và Hamas thi hành thỏa thuận thả con tin và ngừng bắn tại Dải Gaza theo đề xuất của Mỹ.
244,6667a71f653280ea254faaa3,"ANTD.VN - Ngày 11-6, Cơ quan CSĐT CAQ Ba Đình, Hà Nội cho biết, đơn vị này vừa bắt giữ đối tượng có hành vi tàng trữ trái phép chất ma tuý..."
245,6667a71f653280ea254faaa5,"ANTD.VN - Quá trình điều tra, giải quyết vụ án Vạn Thịnh Phát, Cơ quan điều tra (CQĐT) Bộ Công an đã quyết định ủy thác điều tra và thu về hơn 25.000 hồ sơ trái chủ. Tuy nhiên, vẫn còn nhiều bị hại đã chuyển nơi cư trú và chưa hợp tác trình báo..."
246,6667a721653280ea254faaa7,"Liên quan đến vụ gây tai nạn giao thông trên tuyến tránh Long Xuyên khiến người đàn ông điều khiển xe mô tô tử vong rạng sáng 4/6, Cơ quan Cảnh sát điều tra, Công an thành phố Long Xuyên, tỉnh An Giang cho biết đã bắt được đối tượng gây tai nạn là Phạm Tấn Hinh."
247,6667a721653280ea254faaa9,"Trong thời gian qua, nhiều vụ cháy trong khu dân cư đã được người dân, Tổ liên gia an toàn PCCC kịp thời khống chế ở “thời điểm vàng”, góp phần giảm đáng kể thiệt hại."
248,6667a72a653280ea254faaab,"UBND tỉnh Thanh Hoá vừa có quyết định điều chỉnh, bổ sung kế hoạch phát triển sự nghiệp giáo dục tỉnh Thanh Hoá năm 2024-2025."
249,6667a73f653280ea254faaad,"Nhảy xuống dòng nước lũ tại Hà Giang, cứu kịp thời 2 người, Thượng úy Nguyễn Mạnh Tường được Bộ trưởng Công an Lương Tam Quang đề nghị khen thưởng xứng đáng."
250,6667a741653280ea254faaaf,"Cùng với việc nỗ lực thực hiện các nhiệm vụ nhằm bảo đảm hoàn thành thắng lợi Nghị quyết Ðại hội XIII của Ðảng, các ngành, các cấp, địa phương, đơn vị cũng đang tiến hành các công việc chuẩn bị cho đại hội đảng bộ các cấp, tiến tới Ðại hội lần thứ XIV của Ðảng."
251,6667a743653280ea254faab1,"Ở chương trình Nhập gia tùy tục tập 10 lần này trên VTV3, hai người bạn quốc tế trùng tên Daniel cùng vào bếp tham gia thử thách chế biến mì Quảng gà. Trong khi Jones Daniel (người Anh) vào bếp hào hứng, sôi động thì ngược lại, Duy Daniel (người Mỹ) có phong cách nấu ăn đủng đỉnh, nhưng món ăn lại rất tuyệt. 'Kẻ tám lạng người nửa cân' đã làm khó Á quân MasterChef Việt Nam."
252,6667a74e653280ea254faab5,Đội tuyển Hà Lan vừa đón nhận tin sốc sau khi tiền vệ trụ cột Frenkie de Jong phải bỏ lỡ EURO 2024 vì chấn thương.
253,6667a750653280ea254faab7,"Đóng cửa ngày 10/6, giá dầu lấy lại đà tăng, phục hồi mạnh mẽ lên mức cao nhất 1 tuần qua. Cụ thể, giá dầu WTI tăng 2,93% lên 77,74 USD/thùng. Dầu Brent tăng 2,52% lên 81,63 USD/thùng."
254,6667a7aa653280ea254faab9,"(Tổ Quốc) - Với nguyên liêu là loại rau vô cùng quen thuộc, bạn hãy chế biến những món ngon chứa nhiều chất dinh dưỡng. Các món ăn này có tác dụng bổ gan, bổ máu, bảo vệ mắt, nhuận tràng, thanh nhiệt giải độc, cân bằng pH."
255,6667a89e653280ea254faabb,Hot girl người Hàn Quốc Lucy Park cởi bung cúc áo khoác croptop dù đang “thả rông” vòng một khiến người nhìn ngượng đỏ mặt.
256,6667a89f653280ea254faabd,"Nghe lời trăng trối, chúng tôi không biết có đáp ứng được tâm nguyện của mẹ chồng không nữa?"
257,6667a8a2653280ea254faabf,"Những ngày phải đi qua ""vùng thời tiết xấu"" của đời mình, tôi vẫn thường chạy về núp lánh vào vợ mình. Bởi tôi biết không đâu an toàn bằng trái tim phụ nữ. Một người phụ nữ yêu mình…"
258,6667a8cc653280ea254faac1,"GD&TĐ - Hường và chồng là Vũ Hoàng Hải cùng hoạt động mua bán trái phép chất ma túy với số lượng lớn rồi chia nhỏ, chuyển cho các “chân rết” để bán lẻ."
259,6667a8cc653280ea254faac3,"GD&TĐ - Tin vào lời mời gọi, dụ dỗ 'việc nhẹ lương cao' ở xứ người, nhiều lao động đã không ngần ngại xuất ngoại để tìm công việc mơ ước…"
260,6667a927653280ea254faac5,Truyền thông Thái Lan chú ý tới việc bóng chuyền Việt Nam không tham dự giải đấu lớn tổ chức vào tháng 11 năm nay.
261,6667a971653280ea254faac7,(Dân trí) - Các quan chức ở Washington có thể tìm cách đạt được một thỏa thuận với lực lượng Hamas để đảm bảo việc thả con tin người Mỹ ở Gaza.
262,6667a972653280ea254faac9,(Dân trí) - Đại học Ngoại ngữ - Đại học Quốc gia Hà Nội - vừa công bố điểm trúng tuyển bằng phương thức xét học bạ THPT kết hợp phỏng vấn.
263,6667a972653280ea254faacb,Hình ảnh nữ ca sĩ nổi tiếng biểu diễn trên du thuyền sang trọng đang được chia sẻ rộng rãi trên mạng xã hội.
264,6667a975653280ea254faacd,"VOV.VN - Nguồn khí thải từ ô tô, xe máy là một trong các tác nhân chính gây khói bụi và ô nhiễm không khí, đang tác động đến hàng triệu người sống và làm việc tại thành phố lớn."
265,6667a978653280ea254faacf,Một quan chức Nga ngày 10.6 tuyên bố lực lượng hàng không vũ trụ nước này đã thực hiện 6 cuộc tấn công vào các cứ điểm của những &quot;kẻ khủng bố&quot; ở hai tỉnh Homs và Deir ez-Zor của Syria.
266,6667a99a653280ea254faad1,"HLV Ronald Koeman cho rằng Barca mạo hiểm dùng tiền vệ Frenkie de Jong quá sớm, khiến anh tái phát chấn thương, lỡ Euro 2024."
267,6667a99a653280ea254faad3,"Trung vệ Antonio Rudiger và tiền đạo Niclas Fullkrug va chạm trên sân tập, chỉ ít ngày trước khi Đức đá trận khai mạc Euro 2024."
268,6667a99f653280ea254faad5,"Bộ trưởng Kinh tế Luis Caputo khẳng định, Argentina đang dần thoát khỏi suy thoái kinh tế. Tuy nhiên, những số liệu thống kê vừa được Viện Thống kê và Ðiều tra quốc gia Argentina (INDEC) công bố mới đây khiến nhiều chuyên gia phân tích thị trường tỏ ra nghi ngờ về tuyên bố của ông Caputo, khi mà sản xuất công nghiệp của nước này thời gian qua tiếp tục tụt dốc. Quỹ Tiền tệ quốc tế (IMF) nhận định, con đường phía trước của Argentina vẫn còn nhiều thách thức."
269,6667a9fa653280ea254faad7,"Vì sao bị sỏi thận? Dấu hiệu sỏi thận là gì?  Sỏi thận có nguy hiểm không, có tự hết không? Bị sỏi thận uống gì? Sỏi thận nên ăn gì, kiêng gì đẻ không tái phát"
270,6667a9fb653280ea254faad9,"(Dân trí) - Trong 3 ngày từ 8/6 đến 10/6, 316 vận động viên đến từ 14 quốc gia và vùng lãnh thổ đã tham gia thi đấu giải Thể dục Aerobic Châu Á lần thứ 9 tổ chức tại Cung thể thao Quần Ngựa, Hà Nội."
271,6667aae0653280ea254faadd,Vừa mở cửa phòng khách sạn hai cô gái sợ hãi khi chứng kiến cảnh tượng giống như trong phim kinh dị.
272,6667aaf6653280ea254faadf,Quân đội Ukraine vừa tuyên bố đánh trúng 3 hệ thống phòng không S-400 và S-300 của Nga trong đợt tấn công bằng tên lửa vào bán đảo Crimea.
273,6667ab1f653280ea254faae1,"Tham dự giải Câu lạc bộ Văn-Toán Tuổi thơ toàn quốc năm 2024, đoàn học sinh quận Hoàn Kiếm (Hà Nội) đã xuất sắc giành 02 cúp Vàng đồng đội cấp Tiểu học và cấp Trung học cơ sở."
274,6667ab5c653280ea254faae3,"Link xem trực tiếp trận tuyển Việt Nam và Iraq tại vòng loại thứ 2 World Cup 2026, diễn ra lúc 1h00 ngày 12.6."
275,6667ab6f653280ea254faae5,Những điều nữ diễn viên chia sẻ trong buổi phát trực tiếp gây chú ý.
276,6667ab99653280ea254faae7,"Bộ trưởng Lương Tam Quang đánh giá cao và đề xuất có hình thức động viên, khen thưởng phù hợp, trước hành động dũng cảm lao xuống dòng lũ dữ cứu người dân của thượng úy Nguyễn Mạnh Tường, Công an huyện Mèo Vạc (Hà Giang)."
277,6667abd4653280ea254faae9,Các binh sĩ Israel được cho là đã giả dạng làm người tị nạn và đi trên những xe tải chở hàng viện trợ để tiến hành cuộc giải cứu con tin mạo hiểm tại Dải Gaza mới đây.
278,6667abd7653280ea254faaeb,VTV.vn - Bộ phim lấy tên một ca khúc nổi tiếng của nữ danh ca gợi nhiều hoài niệm cho người hâm mộ.
279,6667abeb653280ea254faaed,Tây Ban Nha- Ba khán giả phải nhận án tù cho hành vi xúc phạm tiền đạo Real Vinicius trong trận đấu hơn một năm trước ở La Liga.
280,6667ac4e653280ea254faaef,"(Dân trí) - Tối 10/6, đội tuyển Việt Nam có buổi tập làm quen với sân thi đấu Basra International và hoàn thiện khâu chuẩn bị cuối cùng cho cuộc đối đầu với đội chủ nhà Iraq ở vòng loại thứ 2 World Cup 2026."
281,6667ad7c653280ea254faaf1,"Bất chấp hiểm nguy, nước chảy dữ dội, Thượng úy Nguyễn Mạnh Tường đã nhảy xuống dòng nước lũ, cứu kịp thời 2 người bị nước cuốn trôi, đưa vào bờ an toàn."
282,6667adaa653280ea254faaf3,"Tỉnh Bắc Giang thực hiện nghiêm túc việc kiểm điểm, đánh giá, xếp loại chất lượng tổ chức Đảng, tập thể lãnh đạo và đảng viên, cán bộ, công chức, viên chức hằng năm."
283,6667adba653280ea254faaf5,EU muốn duy trì đường ống dẫn khí của Nga qua Ukraina theo cách đặc biệt để lách trừng phạt của chính mình với khí đốt Nga.
284,6667adeb653280ea254fab5f,"Ở những tháng cuối của thai kỳ, nhan sắc của Sam vẫn đẹp không khác xưa."
285,6667adff653280ea254fac4f,"Trong 2 tập đầu tiên của ""7 năm chưa cưới sẽ chia tay"", Thúy Ngân diễn tròn trịa nhưng chưa ổn về đài từ. Trong khi đó, nam chính nhận nhiều tranh cãi về diễn xuất."
286,6667ae05653280ea254fac75,"Do “nghiện” game nhưng lại thiếu tiền ăn tiêu, Hoàng đến khu đô thị Văn Phú đột nhập vào một ngôi nhà trộm 8 chiếc điện thoại di động, 3 máy tính xách tay."
288,6667ae25653280ea254fac79,Giới chức Mỹ thông báo sẽ cho phép lữ đoàn Azov của Ukraine sử dụng vũ khí nước này viện trợ sau nhiều năm áp lệnh cấm.
289,6667ae39653280ea254fac7b,"(PLO)- Nhiều người dân chiếm dụng lối đi bộ trên cầu và cả lòng cầu để buôn bán hàng hóa, tiềm ẩn nguy cơ t.a.i n.ạ.n giao thông cho người lưu thông là rất cao."
290,6667ae47653280ea254fac7f,"Là một trong những cây công nghiệp chủ lực của Việt Nam, những năm qua, cây cà-phê đã tạo việc làm và bảo đảm thu nhập ổn định cho nông dân nhiều địa phương. Hiện nay, các địa phương và người dân đang đẩy mạnh ứng dụng khoa học-kỹ thuật vào sản xuất nhằm tạo ra sản phẩm chất lượng phục vụ nhu cầu tiêu dùng trong nước cũng như xuất khẩu để nâng cao giá trị loại cây trồng này."
291,6667ae47653280ea254fac81,"Thị trường cà-phê nối dài đà suy yếu từ cuối tuần trước. Đóng cửa, cà-phê Arabica hợp đồng tháng 9 giảm 1,29%, cà-phê Robusta cùng kỳ hạn đánh mất 1,11% giá trị. Theo Sở Giao dịch hàng hóa Việt Nam (MXV), giá cà-phê sụt giảm trong ngày hôm qua chủ yếu do lực bán từ Brazil, thay vì các yếu tố cung cầu."
292,6667ae4c653280ea254fac83,"Trong phần thứ hai của bài viết ""Tự hào và tin tưởng dưới lá cờ vẻ vang của Ðảng, quyết tâm xây dựng một nước Việt Nam ngày càng giàu mạnh, văn minh, văn hiến và anh hùng"" kỷ niệm 94 năm Ngày thành lập Ðảng, Tổng Bí thư Nguyễn Phú Trọng nhấn mạnh: Ðảng ta luôn xác định: Con người giữ vị trí trung tâm trong chiến lược phát triển; phát triển văn hóa, xây dựng con người vừa là mục tiêu, vừa là động lực của công cuộc đổi mới."
293,6667ae61653280ea254fac87,"ANTD.VN -Trong 3 ngày, từ 10 đến 12/6, hàng loạt chuyến bay đến sân bay Cam Ranh, Khánh Hòa phải thay đổi, điều chỉnh giờ khai thác do yêu cầu từ nhà chức trách."
294,6667ae61653280ea254fac85,"ANTD.VN -  Chợ đầu mối, chợ dân sinh sẽ tuân theo các tiêu chuẩn mới theo Nghị định số 60/2024/NĐ-CP vừa được Chính phủ ban hành, quy định về chính sách, cơ chế phát triển và quản lý chợ."
295,6667ae61653280ea254fac89,"ANTD.VN - Số người tham gia bảo hiểm y tế năm sau luôn cao hơn năm trước, đặc biệt tỷ lệ người tham gia bảo hiểm y tế tăng trưởng bền vững trong bối cảnh nền kinh tế gặp khó khăn, thách thức nhiều hơn là thuận lợi."
296,6667ae68653280ea254fac8b,ANTD.VN - UBND tỉnh Hải Dương vừa có quyết định xử phạt hành chính Công ty CP Thép Hòa Phát Hải Dương trong lĩnh vực đất đai.
297,6667ae68653280ea254fac8d,"ANTD.VN - Theo Quy hoạch tỉnh Hưng Yên vừa được Chính phủ phê duyệt, tỉnh này đặt mục tiêu đến năm 2030 sẽ trở thành tỉnh có quy mô kinh tế và trình độ phát triển trong nhóm dẫn đầu cả nước…"
298,6667ae68653280ea254fac8f,"ANTD.VN - Hà Nội bổ sung 1 dự án xây dựng hạ tầng nhà ở, đất ở diện tích hơn 4 ha vào kế hoạch sử dụng đất năm 2024 của quận Tây Hồ."
299,6667ae68653280ea254fac91,"ANTD.VN - Theo khảo sát Manulife Asia Care 2024 vừa được công bố, ung thư là một trong những mối lo ngại hàng đầu của người Việt về sức khỏe. Mặc dù các phương pháp điều trị ung thư ngày càng hiện đại và dễ tiếp cận hơn, nhưng chi phí điều trị cao và sự thiếu hụt về các kế hoạch tài chính dự phòng sẽ gây ảnh hưởng không nhỏ đến sức khỏe tinh thần cũng như tài chính của người bệnh."
300,6667ae6b653280ea254fac93,"ANTD.VN - Dự kiến vào chiều nay, 11-6, Ủy ban Thường vụ Quốc hội sẽ cho ý kiến về dự án Luật Thủ đô (sửa đổi), về quy hoạch và điều chỉnh quy hoạch Thủ đô Hà Nội..."
301,6667ae6b653280ea254fac95,"ANTD.VN - Vừa có thêm gần 700 loại thuốc sản xuất trong nước phục vụ nhu cầu điều trị, phòng chống dịch được Bộ Y tế cấp mới, gia hạn giấy đăng ký lưu hành…"
302,6667aeb4653280ea254fac97,"Tìm việc làm thêm cho kỳ nghỉ hè là nhu cầu được các bạn sinh viên vô cùng quan tâm. Tại Công ty Cổ phần đào tạo Sedu, nhiều cơ hội việc làm cho sinh viên đã được mở ra với nền tảng thu nhập và những cơ hội thăng tiến hấp dẫn."
304,6667afdb653280ea254fac9b,"Kinhtedothi - Bộ TT&TT đang lên kế hoạch cho Ngày chuyển đổi số quốc gia năm 2024 với chủ đề ""Phổ cập hạ tầng số và sáng tạo ứng dụng số để phát triển kinh tế số - Động lực mới cho tăng trưởng kinh tế và năng suất lao động""."
305,6667afdb653280ea254fac9d,"Kinhtedothi - Vào thứ Hai, Apple công bố chiến lược ứng dụng trí tuệ nhân tạo (AI) mang tên “Apple Intelligence” vào các thiết bị của mình. Những bước đi đầy hứa hẹn này sẽ được đồng hành bởi “ông lớn OpenAI."
306,6667b00f653280ea254fac9f,"Các ngôi sao của Manchester United đang gặp nhiều thái cực về tâm lý khác nhau trước thềm EURO 2024, chuyện của Luke Shaw và món quà dành tặng Tom Heaton là ví dụ điển hình nhất."
307,6667b011653280ea254faca1,Nhóm nhạc Hàn Quốc - TXT tiếp tục gây ấn tượng với khán giả quốc tế trong chuyến lưu diễn tại Mỹ.
308,6667b037653280ea254faca3,"Tin nóng Thể thao sáng 11/6: Ngôi sao bóng chuyền nữ Việt Nam khoe ‘năng lượng chữa lành’, được nhiều người khen ngợi hết lời, trong đó có cả hoa khôi Lê Thanh Thúy."
309,6667b062653280ea254faca5,"Cơ quan Cảnh sát điều tra Công an quận Tây Hồ, TP Hà Nội phát đi thông báo tìm người biết thông tin vụ tai nạn chết người xảy ra tại đường Võ Chí Công."
310,6667b064653280ea254faca7,"&quot;Gia tài của ngoại&quot; - bộ phim cảm động của Thái Lan vừa ra rạp Việt đã cắt đứt chuỗi chiến thắng liên tiếp của &quot;Doraemon: Nobita và bản giao hưởng Địa Cầu&quot;, đồng thời nhấn chìm bộ phim do Tuấn Trần đóng chính."
311,6667b06f653280ea254faca9,(PLO)- Tập đoàn Than – Khoáng sản Việt Nam (TKV) tiếp tục rà soát lại các chỉ tiêu kế hoạch của năm 2024 để điều chỉnh cơ cấu tiêu thụ sản phẩm hợp lý nhằm đảm bảo hiệu quả sản xuất kinh doanh.
312,6667b079653280ea254facab,Anker đang thu hồi mẫu pin sạc dự phòng 321 Power Bank do nguy cơ cháy nổ.
313,6667b081653280ea254facaf,"(Dân trí) - Thông tư mới về chuẩn chuyên môn, nghiệp vụ của nhà giáo giáo dục nghề nghiệp quy định chứng chỉ kỹ năng nghề theo hướng mở nhưng không hạ thấp chuẩn nhà giáo."
314,6667b097653280ea254facb3,(PLO)- Thời hạn để thí sinh nộp đơn phúc khảo bài thi đánh giá năng lực đợt 2 của ĐH Quốc gia TP.HCM đến hết ngày 13-6.
315,6667b09c653280ea254facb5,"VTV.vn - Ngày 10/6, Đoàn công tác của Bộ Giáo dục và Đào tạo (GDĐT) đã làm việc với tỉnh Yên Bái về công tác chuẩn bị thi trên địa bàn."
316,6667b0a1653280ea254facbb,"Với việc có trong tay một trong 6 cuốn hộ chiếu dưới đây, du khách đi khắp thế giới mà không cần phải tốn một xu xin visa."
317,6667b0b2653280ea254facc1,"Hiện nay, người dân ở huyện Châu Thành (tỉnh Long An) đang bức xúc và đề nghị UBND tỉnh có biện pháp xử lý nghiêm những trường hợp vỡ hụi với số tiền lên đến hàng tỷ đồng."
318,6667b0b6653280ea254facc3,"(Dân trí) - Đánh giá đợt 1 của kỳ họp thứ 7, Chủ tịch Quốc hội nhấn mạnh nhiều nội dung thành công tốt đẹp. Trong đó, công tác nhân sự được tiến hành kịp thời, đúng quy trình với số phiếu bầu rất cao."
319,6667b0c6653280ea254facc5,Yajaira Quizhpi (46 tuổi) - đại diện vùng Sierra - đang dự tranh danh hiệu Hoa hậu Hoàn vũ quốc gia Ecuador.
320,6667b0fc653280ea254faccd,"(Dân trí) - Trải qua thăng trầm của lịch sử, vòng xoay khu vực chợ Bến Thành từng bị tháo dỡ để xây dựng nhà ga metro, nay chuẩn bị được tái lập về chốn cũ."
321,6667b103653280ea254faccf,"Nguyên nhân chính gây ung thư trực tràng là béo phì, hút thuốc, uống rượu bia thường xuyên, ăn nhiều thịt đỏ và chế biến sẵn."
322,6667b105653280ea254facd1,"(Dân trí) - Trước trận đấu quyết định tranh vé vào vòng loại thứ ba World Cup 2026 khu vực châu Á gặp Singapore, Madam Pang dành lời khen cho các cầu thủ Thái Lan."
323,6667b105653280ea254facd3,"(Dân trí) - HLV Real Madrid, Carlo Ancelotti cho biết nhà vô địch Champions League mong muốn thi đấu tại FIFA Club World Cup và phát biểu của ông về việc từ chối tham gia giải đấu là hiểu lầm."
324,6667b10a653280ea254facd5,"(Tổ Quốc) - Với nguyên liêu là loại rau vô cùng quen thuộc, bạn hãy chế biến những món ngon chứa nhiều chất dinh dưỡng. Các món ăn này có tác dụng bổ gan, bổ máu, bảo vệ mắt, nhuận tràng, thanh nhiệt giải độc, cân bằng pH."
